{"artifact_digests":{"artifact.089278e407a70c85dab5e13b":"04f4b1da85c59c3198fcd86e17a97a7413c36eda0b1abd5fcdeef82fbe6e2e50","artifact.0d22fbeef56b8e62b65dc912":"5df0fe6280a493785eef79fc2242111fb7ea39c989dd230bc1591f74987ff5be","artifact.0f6a06190e60af32bdf8d150":"80351675752f95c2b17c6464b272da193bfaf06701543b60ee401111592f23be","artifact.12fa47aee194394fa64d5be5":"913883c4e1c0d345c56d089d9bfbc38854867c23d40f56821679c3cfafdb5ffe","artifact.16b40e062ff932a65192339f":"2cc503ab200959b7aea4cf95c63ebd11b0c342ec9ce43e495192ccf3c899066e","artifact.178bbf7506380dd7e316c911":"ecb4d817c4b3d533bb19eb33f3f3a22706ec787a51adf2f525f1f80d613a0af2","artifact.18beadca3e327c9abbd4eba6":"95429e2c2176fcd2f73f1f382c2b3854778e921be44e2e1355fc55f57905c77e","artifact.195a82132c0f162e8469b18a":"93b4430952ec974b1454e5e8b2871e8cbb15cb652a94b9b3e5b493b24a8b9596","artifact.1a13d8da2d968cd26f815122":"58f6b9566ac83ad74f875108704586fda19381a9e7378aacb2e9039be9d13957","artifact.1ad5483ad0215bd40981cc6d":"897482398ee58e73ca5d779f6949cc442c8d6c9e8875c87a7b08b09607d6466b","artifact.1b18a6b64bd8196a8b564191":"e5c75f76961145dbd07df747551108d6b863e08ae845d76051fb7318d8d38339","artifact.1f939c8c803cc76d13ec1f40":"791a865c6c0a92d7c9d66383a338ab917f1ee3eac6f431cd7989c804fc42a066","artifact.1fe5582f7107948b91704df5":"eb701b815233497a695e241ffafc15adde953f2708ecd13571caaea3a99a298c","artifact.230bfbde3fe37076df2bf3bc":"f5c77154ff2902dbdfd84495650a4c21fcb30261e3a25898fe69c3842f786e6f","artifact.236f1b58568ee54d4661f1db":"4f5b3dbccbb106925fd18c6f78be04079cd1b6c90e0cf8776c86b1eff0b3f4de","artifact.2379577a191a280d4cfd7a23":"73b782171ab179b5bca43d166b06987adb42b79cf4006a36884e8d873378b52a","artifact.273364cb111e3457681373d4":"34ea51faa8bf7826e4cc3f06aad2dbf5ffe4f6467a7c2f97531902f42cca1961","artifact.27b9297a8abbb1b6ec95ce7a":"b986fbabdbb1de4d2b8e84b41210690b75b0618c8ff8de23010c11b5bb0de7b4","artifact.29f3dda15053af53d7f1ba9e":"d6fc9a858d470473011069945b6df66ad04623832fd49efbcbe9829b9164e920","artifact.2b5a8733c51862cfb8a6f53e":"5fa4f18ef178727703bc070b7953e4c969010e9f694906990cb71232dbc48359","artifact.2d20bbb8abec89c91f28403d":"10a01ac51e9160602ca7815ad12eccea0b3fe3b036910c8fcd063b33bef89904","artifact.2d2ab60d97021591d24230af":"c66e4a92fdc7a216118e43b7a5024ea2200e8c43f9310bf20d96a0084f82c5bc","artifact.2d7ca27638dc50878e18505e":"77e6520c26aa61381f7e433a84015a46b29666d30e34ac2c1b64e15729906116","artifact.2d9749402856e585094374bb":"71f08be810f1b4f9cbd01fc01c97c9b2dfffc623095f62aca7d3f51afb20e7af","artifact.2df1aa7d6516412eb95d0509":"fa795692b4fb7a8a63df82edd98a4649b8352511ca27b4b1ef54f7815fa59d65","artifact.2e3b0095756d7a20ee55e4fa":"f8ac2c75e7f629a87565c80d61ff9fe5aa15cdea0bda997d52a4dc13fdbd19cb","artifact.2f54156f9282e8f7f02e0a65":"15f9d87176c18b55df94b0439afa962dfafcfcfa21f8021e2e8641307dc764fa","artifact.2f6f39938c0fa02c95fb83bf":"743e4312f4401575bca2da8e1a33c0a7126078e31e3799a8ff08ed68b0c7eb35","artifact.3053fb7f23eb4b4d155733c9":"990d176bf38de8117566ebf163aa3b3f9d8a5d8f840ead604db98ee2cd985e90","artifact.305e0ee58afec6c43bb03d79":"f35651a1bab865ffbfcad5399142e9366d5b5d796df9d78e8414a0d59e31d50d","artifact.327f89bdbcfafad3b669ea84":"48fe0c084a14482003ed3e493bbab87dac91cf9f91445571401d0eff6b18d21c","artifact.35b42c0d361d2a06c50b8e78":"0a944e7a2bbf08f81745f6743bc5f9c0e618201a37baef25422cb9a139f745c5","artifact.368b5050a67ac0c30b459ebb":"cde82fcfaa81bccdc93fca521baee7aaf0162a617abac3aef2df7ad6ae8f8bc5","artifact.36f607f8db50bba64a4088d7":"c822423da59bc2c93a3bc0b1606c1eae3008d5e195a7966ba7157737a56a1076","artifact.37208a1a480abf4ff06b9efd":"4d26bc19f056f0a44ee4cd209cc7fe9367359c99f5839141a352d938ba1a9120","artifact.379a5109a550e848ee82e6ed":"8ebdb7697d0489e7398eb4b0bd172f458bc73d77870a43eb8c37d0a5a5b840e2","artifact.3eda52a3e953b1fa9656e99e":"198d4cc8c4c8a9388bad16bf7d8d40e818e6432872f182b981832830fbd0eada","artifact.404f900248b8f2da15d9ec73":"6546ec9051bd47bc9fa59af095f5c6429b28fa6ce69dcfd01cc6347b021b0500","artifact.4100e4fe1b10cf0bc420c8fb":"867bb317af3ef4a7903dcceb470a7aaef834f486591884d477e1774e7b9b9695","artifact.411daf2c46db381bcc692688":"5c537d6853e005298a285d508cff9ac7192cea23576c840d485b2b586a7ff177","artifact.4138e581273842a0ffeb6cb2":"727409b9add94af26b3b950f6ed9c5f05179dfecb4d9ae36d5e548053b7d7ea1","artifact.423b886d506c763d5ab845b3":"4ee03558477c239f7a0c667d2c80c2bd22969e7ef7d7ca12e409e13b537385e7","artifact.4546f1820af6e4f4984dd96e":"ee6a7b1b00b1b12650bf6cb094b4e7e0ffae394d3783a39f1b1f238f05592fad","artifact.475452012ce0f55c6dbbdcb4":"641a6db7551ca27afe493ac9981bd997c4ce05b467d3ccdfcdff8e5ceb107310","artifact.48801e1cf2c4ce9936bf0fcb":"cff224e10b928347fbe2fd671797b80b5bb3a7eb909e9c3ad777e212f1698d69","artifact.495ae9b283bc9180d8e8ad33":"5901931079f8087da1aced97b06a892d383973aeeafc15eb494f90e13e7cde5c","artifact.49c350bc9faebdf29d85a850":"08d1afb3bb8e0e9e251aca370d93374be601f595325975d76e703b48c648b153","artifact.49d15e438b648655928fdef6":"bb4318bbc5fe736176415a117a90783ff6d33f5a264505b3a40037b4b1077668","artifact.49e75f62dda0f9df56abd329":"5952105db481f0e793caedd5c5668069a0af8ecd198b2539d19b17c18b47640e","artifact.4a4a69c9dbf20f7f15c1b233":"ffdbedf5ca5c5f5ba8383b336fca65b2b4ced22756497a7ae4c81508ccdc7307","artifact.4b54cd58a1326fe8d5ee34a4":"83d7472e27cc8408b3072e57a2313768c8840f7c652d6311eb975617f0bf7ff9","artifact.4e7de4021c4544b8488806fa":"8b550e6a8a1336806f479d9eb64ba2298579a3bbc7f8bf9514cfd14d8c034306","artifact.4e95e912d7780d2ef765d7ec":"e804f384f34a52947fd96980f92c08e44ccf323fb2bad3396a4059a9516f2248","artifact.4f232d9a90ed075e1ae6aebd":"ec3f8ac460dfe2f06d4757317c5932630143e9ce498c1c3168ca798a813e182b","artifact.5267e9b1786d03c6b7dab18a":"ebaa690ebc2e8c992a1ca975e543536e361ff3670beacb04e2da3a63eed7a51f","artifact.52efe39cbbc214ea91209169":"538a8875cf30998efce851dd984195230d936e28ca8c997dda77be1d10dbc9d0","artifact.532c24060f9aad17e03fa08d":"ed6f6bc7da5ae8eda9c2a9052018d9dc034349d4c1fdb7fcac0f4e9c0b9d144f","artifact.545028007333f25aa169a650":"0987a71f1ca477f86f8e1f0712e786f937e0c56f99a6218bc9d9c872cc66b800","artifact.548ef12bcaa6c2a2d29e30bf":"ff11ff5d71257c0f64bb09c55b5e6c35efbe40a6efa7969278d2836479b19965","artifact.5561b68cc3a79efddafa9c24":"d7ef97fc31060a48b2a272a839d8b892338a33268f37dabb1cacfacaeacd98f4","artifact.56d3bcbe6212b678106a0c0e":"5118138bc790d4b43f03b19e13c93262feffb2ed0143c7e0b4e4e82f0a49645a","artifact.57fa7e04da4e6c43606f0179":"23c193a8b3cdf71b2fe19518d3de9784f57e9802fee5b383c36c76dd0d1a4b98","artifact.5a3bf5611a290205f9900c5a":"386211873e5b7a02f663ae4d7adf96285999f91608f8f9f31fecfd0f4095e6f1","artifact.5b5cc1f2e211dbf001e6a488":"37936a384c92826e8b1aba47a312e6e3dc110050d734489ad7168de33f2a6244","artifact.5b8632979c8172c163128ab0":"3b3db2115568ff5504ce040a9bf02ede1658aae378a88c1aa87e59d489fc709a","artifact.5e96737bb91526ff4113c06e":"2e53a709ad987c9fa5fd814736ab06b7b678a274ce88a812db8a9ed96355c5f5","artifact.5f243a266a969a3ddf744ffc":"6c754395c2c0dad94a34003547492f99b3fce1416ec0ac06cc84f5283f32892f","artifact.5f4e14eaa4e392b49c830971":"44a6d288a6fb1c819362ba9459f93e32c0065673bbbe79c1de164531f8c2ac72","artifact.6341deb1930076a0ab0b8854":"de9b7a1b5b5d32dd6246fafc389865143a4add67b981dc7e06bf616e8bd0d129","artifact.6509edd1006172f28cba86cc":"e780fbd26f78756dae7d18977d18cd4e324429120ad411964c62ccfc3e0c38c3","artifact.6589826b858f04ee9ec53227":"90457546973723a6579e2b80e4f5a518418d3ae77ab66d94841c42de042d4722","artifact.6677621db5b602dfdc01571a":"a66fffb82ceeb0e03f9a6b7bc734680d88d593d26c5224834c5738a825b6d98f","artifact.669a0ebc9aa96e32c69168e0":"ec71ba246ec7d19f5de00941ab98e09905188a839a64ff09c06f83c00f383b35","artifact.68ee790e8ceb41fb42230db2":"940be5292a3e6365674257373ea5305ad6ba16ecafc445d0aa4beb654f24cc71","artifact.6c59c885139d5c563a6d05a7":"2a7c435c9a2e18d8a94c7edd7b86b48905dcdcc51375313c1634e30895221411","artifact.6de38227dc2d91b0ce6002e3":"2f23507e68a2a3d270963073f26a420fadacadc1a93fe871f58142c2c44b8993","artifact.6f10e2b2c0f3e22665378349":"2f1414421c4e361009a34397d9d2cee3eb019286401c6b063be39c8148d7ffe7","artifact.70c834685816d568807209f4":"79c45731109015c484d6d0020fe922e0784201c1e4961a6cc21de332847cdfe3","artifact.727dacbfe226d4a0a0692047":"6fc72585bde3fc563131f79b29b6ba1e9c517cbed16c41561fbd08a1527ad8ee","artifact.78b00ca55f0bdc12c83b0f54":"64561e84a3e8e34429e104c17e1106d635a051df36f4a0e9f01a6d7293e6bd5b","artifact.7905416b84ff9fd38199a062":"9c147d0d37f872894006f050edf9c2435733c7717375a75f6a4de21e056d613c","artifact.798197232b14f8c7230a8927":"ff7f14d4be0c1184ded82abd986155b2715bc46dcd366058012756a50f7e9629","artifact.7b4206f0df3ef24f1c96fa8a":"36abfb172f8a3a51c427d80c982fab4477e40b3148e46726ec4058aced3cd6a6","artifact.7bcb881047db9b8a01245d0d":"aacd9eded1d23eee49bb5aa91131bf508af33a5d51a128a211af4fb1519d9536","artifact.7c17f9228429aef611d23228":"b24bdff607be3cccc9c0d804da5194e382991653318d9f7aa5e74392fe10105e","artifact.7ccf1ccc0fe3c59325b4af3b":"b58e87ffc2ffe21c8ec01982479a67babbe4a0ccb3a784a6da78af235938dc12","artifact.7f90adb507c65a6274af3c04":"de943c2932346eb9f40c241203046832058ea48475d8610e3695a326454dcaf7","artifact.802be8f488f43c62c62c1940":"aad9e371907ceb3772d7fc1a4024646de9e067af203c5bb5c825829d24e5aa03","artifact.8292415a4dddbfca1e9d4501":"0ef00f73adacc1f7340588fc33cd6d1a601914b00bd8bd99afac6383d2c60955","artifact.82f6aa2d3de24d3ea67099da":"619d303fb2610490654817291148ff6c3d7dd720d859df932f7f9a557f82e88c","artifact.834de5cacbc19ae304ba93df":"e5bebb5033a9f11aa2106c90891135d530aebaa20398cc0f46bdf79a360c24c2","artifact.85292b7c705d0a3060985f5f":"e246e46756bc490c09aaf177b6732b9454c42cd1eb490987e9e8feac353ad0ec","artifact.8831320e6b2b2321a6cc3f83":"d913fd21a0598340bb0843e26984dd041dc3865439202fce2db78a9771243322","artifact.88dcb54cfc26fd525b89cf26":"afe73edf916969da70d0f8ea3b25899f9494d620c2aaaaf68201451de4f3707d","artifact.88e13371167aa316ca829fbe":"e9f773530735e4fc09fa4e8b5730ec812a3f3c917102d2d0ec9742029db7da0b","artifact.8a42b5127652505c528c7deb":"36547a012008df7ca7a96e7dfd108c50c07c0ea50564d4d56ab18c739128f878","artifact.8a9743cb07803233b12b59e8":"ff1a329c82440e4df146b535399c17806e2837cbbe83904a60ae0e